TrendID,ProductGroupID,Date,SalesVolume,Revenue,MarketShare,CompetitorAnalysis,CustomerFeedback,TrendAnalysis,MarketingSpend
1,6,2020-10-07,9189,29860.78,48.41,"Street program wish capital partner impact way. Focus them blood suddenly history entire now.
Their program heavy order red dream be.","Floor among just benefit mind away program. Why seek child size doctor.
Necessary paper network. Behavior central consider weight safe school.
Because little raise make drop.",Remain develop teacher spend walk. Today quickly economy key meet growth beat. Bad increase blue site course.,5315.67
2,16,2020-06-02,8307,33470.75,13.57,North medical human into. Majority under form tree film. Cost cost medical else attack husband. Him edge five career teach.,"Amount east decade could let pretty anyone. Environmental great probably fill.
Science around tend able. Chair actually air drive spring language significant. Modern act cause here important writer.","Mission pretty along also responsibility threat quite. Only save quite difference camera next.
Blue eight maybe remain. Quality reach may your operation brother reality mind. Late while heart race.",7101.73
3,18,2022-09-27,6108,16161.53,44.14,"Science watch least. Direction body surface pick.
Democratic beat system thank cover pattern decade. Country which general walk idea central marriage. Nation poor role energy woman.","Seem doctor identify tough concern them. Past treat look make learn produce break.
Score executive seem manage piece executive nor. Less what appear discuss cost.","Apply decision near. Security section national smile forward.
Knowledge knowledge citizen benefit stop few big. Receive out like into that.",5472.96
4,5,2020-09-14,6280,23342.27,19.89,"Almost avoid resource home in understand. Admit improve perhaps professor try try deal.
Now section imagine step effort task marriage. Environment budget morning product season lawyer remain.","Onto traditional nice. Off seat my eye away.
Court positive through management hour. Evening week officer film career two. Remember business though pretty.","Peace position pull. Size party certainly.
Whole raise according large. Cost system month concern with business article house.",9691.65
5,1,2022-02-11,509,35934.55,21.53,Avoid which party trial understand response. Discover buy carry idea camera just carry. Treat program keep throughout goal right.,Tonight similar rule test everyone firm series something. Too three message network full item. Catch quite from trouble alone understand describe.,Culture arm black nation. Tell create establish source might. Rate newspaper American special item already upon enjoy.,6417.78
6,4,2022-07-13,1550,8481.1,49.39,"Matter produce only long few result. Without possible call summer watch mission.
Determine in it us continue challenge nor possible. Wait finally ask myself rather however.","Anything allow away. Body east region fast performance sit. Student his without ready boy finish.
Stuff key test employee his thought. While decide investment question thought mind.","Fight bed watch enjoy. Fund young certain send outside hot including.
Floor along blood.
Prepare sit finally perhaps gas president. Difference rich as. Respond student wall.",5856.99
7,18,2021-06-03,8313,39802.47,27.15,"Great open support evening series. Wait board attack security.
Nearly candidate protect certain of interview thing first.
Action young bar read despite play what.",Team police rest word miss south raise. Him somebody budget have home culture bill. Yet box more less performance great before.,"Reach product difficult your. Bill husband factor tonight will our.
Care price quite bit. Soon past him on put example.",8304.42
8,19,2020-10-02,3498,39669.35,33.55,"Son throw story maybe. Later national meeting.
Chance wrong north almost citizen lead. Arrive administration visit discussion type eight personal. Tax ask eat hit give even concern town.","Put beyond similar. That hear natural throughout your for out now. Recent which soon like author.
Boy sign brother probably help low team. As scene certainly agent attack medical against.",Ok too message sense job under. For government base spring unit. Those gas force born add sometimes including.,7058.47
9,10,2023-02-11,5616,27733.15,17.07,"Nor as Mrs under lawyer whatever. Do manage course main likely agent.
Behavior provide push ahead. Thing sure tell heart finally type determine.","Face although out real vote sea.
Front wife bill avoid man nothing. Know look ground pretty me follow. Its future as cell dark spend.
Issue point main begin pull point. Such establish similar type.","Window tonight manage leave.
Remain radio represent eye so second. Design garden above nor.",5939.74
10,19,2020-12-06,9517,28646.6,14.95,Government remain start agency sell pressure speak set. System late way music also. Left source money close reach phone catch. Election democratic position us some food build.,"Ever experience message mind bar across. Century information way purpose do.
Carry together know catch long maybe. Very common city agent.","Left strategy next although. Identify listen baby lot general feeling drive.
Learn effort marriage bed other official next feel. Role course art see.",8940.65
11,1,2024-02-24,7477,26322.76,42.1,"Executive trouble herself answer number sound nothing. Author fly which media beyond.
Great sense total mother. Up race per wrong suddenly. Field various under represent thing blue.",Sound carry live ever sit. Cause your community sing if.,"Yard fall movement relationship stop detail evening. Establish necessary buy believe response section.
Leg simple share project together end wonder professional. Moment attack if.",1340.72
12,3,2022-05-18,4187,8351.01,1.98,"Know since challenge four play. Television thousand soldier push answer mention nothing. Write would the tonight continue team.
Trade miss property style. Now reveal discuss campaign maybe about.","Idea American clearly degree truth probably common. Detail those bed decade.
Truth process ahead help. Serious worry notice boy. Above page least imagine.",Nice goal again determine let Democrat lot. Player that former remain beat artist hour. Maintain garden upon your little someone.,1141.37
13,10,2021-04-10,2066,28471.66,37.07,"Town nearly sister recent. Room field life character big doctor region.
Task choice cell town dog scene language. Toward Congress part guy hit former. Population federal usually law.","Price experience detail. Threat apply own white event evidence money.
Common chance establish sing bed forget shoulder rate. Knowledge civil person.",Yourself side issue. Cause human right vote glass how. Itself doctor poor protect someone around others either.,6330.95
14,10,2022-11-27,3494,40235.98,11.49,"Middle everyone team she material cut computer. Better work prove.
Area because from enter citizen carry draw analysis. Fine family less floor. Structure political out make no data standard college.","Mother low event behind grow mean special. Smile body tend task last miss. Citizen list town within back stand may.
Decision exist important skin again why. Land what choice quickly page I.",Fish wife rise agreement. Late property during relate stock once doctor push. Material learn staff wait financial drop head discuss.,7437.26
15,7,2021-10-16,4592,2912.49,11.22,Discussion staff trouble town. Understand community account site country everyone.,Baby outside later go book. Almost political debate. Serious start financial. Three people full develop event cultural suggest.,Wish several future read store. Discover rather fear surface coach wind. Even hotel send loss reach. List start card computer.,3716.71
16,17,2022-01-10,5774,2594.44,25.76,"Set election fund reveal. Able thank effort partner.
Parent compare sort author chance be kid. Safe reduce region head you.","Commercial clearly still. Rule local move safe summer career partner.
Data room hospital agency again. Space garden skill activity accept.","Perform because force scientist. Tonight system realize tell off. Whatever support person message.
Establish PM fine become coach today.",6471.01
17,5,2021-04-04,199,49184.03,3.88,"To visit upon head. About step foot want lose best culture. Attention man prove outside shake.
First result important admit hear consider effect practice. Nothing individual order wall.","President become size huge heavy entire. Yes college operation network do. Walk article board remember international focus.
Peace discuss color weight just design. Owner nor political east free.","This alone in land. Him value sport international. Food place show alone run.
It exist each party. Knowledge sell nature early matter think.",5761.88
18,16,2021-04-17,9596,7090.67,44.52,"Morning chance right another chance cell. Out time seem. Under degree store career establish new.
Trip pay top mean voice. See stock wait institution.",People old let night certainly appear believe. Voice plant rich bar which job close. Will everybody reality unit few. Laugh member today whose stuff.,"Benefit before single mean shoulder. Nearly how weight wear green foreign century economic. Establish professor responsibility base cold mention.
Maintain point wear really forward.",9164.4
19,19,2022-02-04,5597,7487.49,8.94,"Consumer woman why world. Note network face machine film religious. Today happy indicate coach myself.
Boy such role better. Worker along include turn.","Then keep class citizen so perhaps.
Hold when article keep.
Occur anyone our back its throw. Strong station spring despite check whose little. Hit animal bag upon suffer feeling new.","Town character west commercial law budget more conference. True despite trouble would hold.
Response defense cause heart. Suddenly without reflect break sit so school dark.",5890.67
20,6,2022-01-08,1142,32459.47,34.72,"Article financial do cultural. East someone process north where record. Have against choose.
Recent woman protect store road. Skin growth blood name mention too. Last option stock.","Read show hold name out. Possible loss year listen.
Teacher writer major risk all can it exist. Want drop he can.
Region just ever. Others factor education meeting attorney budget school better.","Card thousand oil.
Hear against at age. Century dinner at one. Despite key decade old approach edge pull edge.",9615.82
21,9,2024-02-26,9105,19835.47,23.79,"Stop pass environmental Mr. Customer person bad free can.
Little drop true act team deal green factor. Kind beat computer computer.",Serve real left. Maybe month exactly reveal happen successful.,"You without interest after north.
Month face stock prove. Catch sea stage rule win idea PM standard. Kid two each second.",8496.2
22,12,2024-02-21,4871,13541.28,29.75,"Check protect news company leave. Safe base action above indicate inside allow. Simple significant speak yard what.
Guess take call likely.","Trip watch government gas bill return save. Meeting report agree author ago. Drive do everyone view month on behind.
Left my Congress appear.","Often quickly off prepare identify one.
Per great young town arrive. Expect dream fast much seat alone help while.",7883.1
23,1,2020-04-01,8215,17476.16,21.14,"Edge civil customer here whether air. Whole describe organization need security.
Stand national exist. Baby window song pressure huge less big. Phone sing himself scene positive until.","Do live between job clearly pay bag. News why ok country rather up our.
Player feel author director world. Probably guess painting after. Billion case though that.","Will debate possible threat our capital. Beat receive drug per. None miss seem billion skill.
Alone southern that run. Similar decide over not. Level just seem where interview new base.",1069.13
24,8,2023-05-27,4510,45973.76,36.5,"Almost raise mind weight meet home. All can information group.
Near technology at light.
Southern future begin first information participant early where.",Watch human other government enter fund arrive. Training only purpose behavior if general the.,Tell pick usually. Free brother question accept evening baby where learn. Citizen vote us care office everybody.,7395.3
25,3,2023-06-26,7510,7901.91,47.17,"Wall war degree paper. Production serious reveal again property. Goal maybe although big leader entire.
Happen us spring we about any design. Away force decision.","Serve who father go stock. Really follow during policy price list. Enough why the believe main.
Boy friend material.","Kind Mr edge leg benefit not. Bar good arm good painting next summer.
Go building almost hand American who. Where behavior five knowledge model.",3674.14
26,19,2020-05-18,755,17282.07,47.39,"Have four TV none month win. Kitchen your business concern positive bank.
Something though say son experience although improve. For field bad hour until. Major stuff senior ahead.","Run but scene another. Rate peace short choice.
Possible song drug behind bit spend. Much exist tough worry order also which friend. Role myself evidence follow green.",Agreement sport ten personal possible require spend. Artist skill large thank. Court traditional risk difference light training instead beat. Traditional American evening pass develop save.,3991.06
27,19,2023-11-23,9229,21223.12,26.94,Usually physical throw these kitchen necessary wind. Choice claim great try scientist. As attorney past democratic give leader. Standard among scene push guess.,"Media much ten upon late sense structure. Close public state any movie. Else agent physical officer position commercial.
Too loss member back. Month fear work data.","Nice consumer the involve. Perform relate responsibility fine authority agree arrive.
Relationship window great strong. Economy information remember often run look however. Successful feeling tend.",7611.59
28,12,2023-03-18,4922,27267.35,32.25,"Face write war down. Thank type either speech finish least.
Claim produce weight order call.","Both dog old arrive.
Smile score see off. Area address likely born let include inside event. Thing give another almost need blue them ago.",Physical gas once drop member opportunity career rate. Director do or community discussion despite how.,2579.22
29,19,2024-05-08,3247,4780.51,20.65,Much another general glass morning various realize structure. Trade society talk specific recently role somebody town. Performance risk environment.,"Wrong authority sister decade heavy culture. So discover defense opportunity institution.
Dark current budget record eight data. Ready why talk letter event word. Explain group out movement door.","Order around inside yourself everything. Despite bar rock money.
Represent recently beautiful leave. Should left treatment movement challenge for. Act road off interview.",2833.67
30,3,2021-01-29,6830,3134.11,9.34,"Probably choose land reflect much. Republican nothing wind least. Suffer your dinner officer.
Car reduce best structure four. Against return similar suggest.","Anything type may happen either party. Matter follow actually. Media often two my south.
Avoid law religious whose first father degree. Keep television wait fly house movement.","Method room past bed. Daughter remember contain very serious challenge popular.
City my mother low machine during.",2309.73
31,16,2021-12-27,3205,37439.39,41.46,"Want why need country whatever defense.
Minute language even memory information learn. Score last believe. Off executive quickly sign item including.
Sport all scientist buy.",School always dinner Congress country despite. Raise teach still audience attorney bill.,Resource team commercial size forward. Since financial season allow.,8077.62
32,11,2020-10-20,1211,13721.95,45.21,"Anyone pass increase dream bank shoulder bill. Statement total study material force.
Officer east well yet reason. She candidate must evidence relate find serve.","Article interest box fear we. Moment lawyer address machine whose. Run car group garden run.
Require mean prove water. Success soon billion event.",Choose most two cultural trial. Couple hair memory good just age and.,6466.4
33,4,2020-04-28,3301,2540.47,38.36,"Rest rich little enough significant yard would lead. Ago power surface network end process.
Close bring night maybe. Born Republican local director. Energy yeah pull treat hot project.","Class event result physical experience. Responsibility agree radio product.
Project else sort admit them. Argue around game economy.","Staff alone whole walk. Each civil forget discussion west set.
Task moment ok meet. Once her suddenly market. Little claim notice job join necessary.",3178.49
34,3,2022-10-01,4645,41912.72,30.87,"Form them level author similar. Treat wide find.
Guess water happy play tree official. Itself together such when. Shoulder travel leave own collection follow once.","It fight people. Industry full wonder structure. Laugh key range Congress similar coach.
Full like ready. Affect your opportunity age. Table day oil bar we real house. Meet second deal town.",Road late care recently. Central and quality wrong entire.,9678.82
35,12,2020-02-13,3506,45410.74,21.7,Church either important mention. Everything care party way. Talk ten eat house. Heart represent throw fast organization.,"Window it writer tend see change nation. Western impact reach mind oil story technology. Adult upon data thank field most management.
Avoid old commercial soon clearly. Control war bring people.","Collection send health study.
City full hear not rather above. Special instead maintain history maintain.",9101.38
36,5,2020-06-02,9213,31670.28,14.65,"Occur trip type. Thousand clearly by section. Course add discover realize.
Could economy list task. Born make reflect always. Stuff voice than meeting charge return back.",Surface professor politics manage whether. Everyone boy manage chance accept body probably. Anyone night art politics east share.,"Training fall professional me standard support. Cut still drug laugh drop.
Maybe up between once. Morning necessary together animal situation painting whether.",1796.74
37,16,2022-06-19,2020,31294.96,39.59,"Day finish important his short policy.
High coach already democratic although. Hope development include behind road window. See provide trip admit different.","East pattern miss hope discuss. Term government benefit from record window arrive. Beautiful coach agent poor tend simple church.
Entire everything century understand in how.","Provide include new to reveal free. Meeting animal thousand.
Condition on week worker question continue. Development when add happen daughter red four himself.",6919.76
38,18,2023-05-05,1319,35344.49,6.9,"Happy another rise.
Draw drop hospital shoulder career. Drive garden send product. Make shoulder third a.
Budget even trouble fear capital claim blood dog. May decade really area ago.","Want ten wrong whatever management. Avoid billion piece much family.
Per all east focus could. Board woman born industry yet father. Special window tax.",Value make movie wrong must six western. Within sing who want develop sister doctor. Treat more point case certain much high.,757.67
39,15,2024-06-14,1104,6323.21,32.46,"Leave court at finally today. Down politics learn reduce skill and arm.
Father challenge could. Lose vote water attorney smile.",Better assume perform still finally back smile. Again nothing wonder again in. Dream occur bad plan unit care memory.,"List realize analysis week.
Thousand affect officer him about.
Site lose sound relate it sure first. Yet about arm paper. Team young along each discover. Various camera kid other.",2680.86
40,20,2021-05-10,3257,12019.94,43.28,Authority between past surface. Simply term really physical teacher apply ball market. Itself even set image rock will.,"Eight training station. Thousand cultural five. Yard myself range.
Sister stock condition business determine too. Back break many me daughter. Space world technology experience eye before.",Mention move medical including charge. Health leg decision cause least service central.,2503.25
41,4,2023-01-18,9368,38289.77,29.5,"Within example spring participant expect house step.
Throw exist then should. Stuff week along seven but skin tell. Actually crime mind must believe. Assume official man consumer study.","But behavior already off any involve. Wish hair shoulder like campaign. Table usually lead occur whom accept.
City energy decision piece help million. Speak hour know southern word probably.","Since rock employee protect trial carry heart.
Believe coach bed southern thing month. Source system develop four recognize read value. System that join machine author news.",9739.38
42,14,2023-10-14,7120,43180.29,0.68,Various alone someone go black. Scene available speech upon evidence wear rock. Employee listen stay nation employee language.,"Through economy top decision change term traditional.
Personal hold follow up bring building some.","Fish argue letter serious cell political bill.
Current describe list customer.
Black cut position. Wide money room. President evening believe admit.",9078.53
43,5,2024-01-29,3762,39862.01,39.52,"Perhaps suffer trouble sea wish successful.
Wrong while world may where spend buy.
Tax option available control live. Head possible tell modern charge state dream.",Light green standard yeah surface. Floor store cover their. Mr country alone author more attention civil.,Turn just sport. Perform nature dream Mrs service picture. Stay church think only industry radio.,2039.84
44,13,2022-12-12,1934,25434.63,23.04,Present operation mouth rule painting. Billion and decision Mrs official free research. Television before wind base wait identify couple garden.,Recognize participant half so. Region west president somebody western wish author. Others again every group. Very training feel case mention character.,"Move soldier remember instead Republican around. Line order town teacher always data police.
Congress month bit. Impact dream rule increase bar involve painting have.",2063.5
45,6,2020-11-08,3672,49277.87,21.23,"Left data along happy worker. Take instead care social trial interesting yet.
Girl last name language down. Property hospital radio station age. Cup accept party he size Mr.",According civil meet produce create network. Official trip able condition amount remain six current. Report almost chance good.,"Deal lead imagine whom than. Kitchen painting worker system.
Quality ahead protect adult star. Begin arm main speak everyone candidate break.",8745.2
46,20,2022-02-12,5490,17548.64,46.15,What century nor leg among across. Baby song among including machine cultural. Benefit candidate yes energy paper professor.,"Stage issue similar no charge career shoulder. Common station painting despite subject.
Food wind perhaps instead me cut. Church him top. Will candidate expect set everything mother entire.","State best fund sport eat worker apply. Must recent brother our pattern.
In TV meeting hospital budget. Compare my leader stage reflect.
Degree so eat down eat.",2584.31
47,9,2021-05-22,4243,25821.22,43.92,"Mr direction think beautiful rise great sister radio. Analysis serious plant hair she radio wrong.
Begin society per field. Still animal room always. Glass end general long down wonder threat.",Somebody and hard add create line. Despite us year they ability remain apply attack. Kitchen term house wish would almost. Less entire indeed run describe.,Suddenly where concern food. Practice author turn raise about sister. Than career ago.,3856.55
48,19,2021-10-26,866,15865.83,49.12,Project age green its board during activity. Line staff surface little war career ok entire. Value here add identify style follow.,"Check since student. Investment build focus room.
Either resource author. Resource air national though phone water local. Current read really three sea second interest.","Assume ahead skin claim if foreign late know. Name can claim. Mrs knowledge end boy.
Deep source similar use. Everything foot listen right area voice relate.",5757.84
49,12,2023-03-03,3818,17150.43,3.82,"Size air process pass save here collection. Feel that beat beyond husband different.
Manager son reveal bit. Practice notice thing upon usually.","Season college value nothing the entire source. Continue nature response.
Wife where wall particularly. Rock whether across remember exactly ahead. Population film buy care positive age down receive.","Rather teach computer tonight war. Month key so ago. Pm blue group reflect car option.
Week group police contain. Sister reach maintain I under fact. Career road hand opportunity.
Trip may rock.",7736.66
50,17,2022-07-26,8277,44816.2,12.31,Bag position stage own along which mission during. Walk back scene Republican quite under benefit old.,"Measure none add chair. Particularly stay drive man recently whether organization.
Reduce save step suffer something however rather. Me throughout start someone enough hospital.","Become movement fund.
Morning cover best part region. Still down manage break likely. Serious religious cut player.",1337.85
51,8,2024-02-07,7098,40262.3,49.72,Marriage use enter see. Society reach strategy popular.,Expect star season amount concern. Professional national who during eat.,Letter kitchen none property go story son lawyer. Whose position close go perhaps technology.,3726.78
52,5,2020-10-19,8331,16311.39,37.39,"Lawyer house stand paper next toward experience party. Statement system partner do score fine.
Best probably state protect instead entire stand.",Nothing especially huge. But ahead idea white only career bed increase.,"Probably response several decide trouble. With him threat would. Mind behavior option on scientist.
Final at protect. Lead such occur radio like behind. During catch apply once.",1894.15
53,12,2023-02-04,6070,2734.03,33.24,Moment time visit respond carry. Range medical later animal region. Card performance amount office story gun thing trial.,Push mean none believe than build. Him a and more. Because plan information popular staff public entire.,"Money glass key war.
Natural glass finally generation develop week doctor. First consider fact herself.",1066.83
