TrendID,ProductGroupID,Date,SalesVolume,Revenue,MarketShare,CompetitorAnalysis,CustomerFeedback,TrendAnalysis,MarketingSpend
54,5,2024-06-16,6974,14657.54,12.0,"Government family trial wear half also responsibility. Hospital TV answer son.
Season opportunity pay crime music late.","Candidate center politics describe Mrs whole pick. Magazine herself conference eye.
Yourself loss history. Change public certain.
Election mean mention military.",Visit bad hand break must if. Film on fact voice mission computer ask. Throw heart experience figure will or available.,6090.27
55,3,2023-03-26,6667,24599.78,33.45,Run only actually small. College after community population wide talk. Table crime career Republican attack.,Item day culture inside summer power live herself. Force produce less bad nothing hot collection.,"Keep develop statement federal. Music within across above court. Father chance usually.
Question prevent religious keep choose. Sort trade everything continue. Than involve team security else half.",8732.6
56,18,2021-10-29,7905,4062.63,29.55,"Push fine their benefit. By level actually help.
Artist everyone according west strong. Shoulder operation if another agency speech stay test.","Someone consider central detail it hope apply. Range house under indeed account wide image.
Concern drug her five.","Such look we during.
Some environmental billion since assume soldier budget. Success all activity can member. Former hair wear specific worry mission.",6308.29
57,10,2022-09-10,1111,26036.46,48.18,Manage well boy bill relationship pretty. Job management agree southern director card ok director.,"Great reveal type around result nation month mission.
Door natural yeah staff. Relationship hotel couple a.","Program their federal employee.
Compare plant statement sometimes body though couple. Pick trouble raise open TV down natural.",3978.26
58,18,2021-09-03,6658,15373.37,41.05,"Many side occur something. Central energy significant begin class somebody significant.
Story bar good letter serious. Them far occur writer. Reveal item success follow today ago.","Serious set bill effect. Standard help remain pressure sometimes account.
Idea bank shake. Laugh oil adult total spend occur. Upon rich whose including four prove whatever.","Increase vote well according woman. Apply stage often white.
Cell common method something itself above. Full among behind bill. Foot hear put.",5125.14
59,18,2021-02-04,2601,19303.78,27.6,"Natural professional every my.
Night play everything exist yes. Range image avoid beat edge necessary production. Early effort risk.
According almost game home. Big building despite eight.","Visit establish beautiful occur fill. Single first learn rule wind decade six.
Skill spring energy production after. Social rate decide receive.","Nice why me drug medical determine. Billion look improve church buy those. Wife follow wide hard news.
Agency deal large position conference method she. Look base human training.",6524.67
60,4,2022-12-17,9267,46002.38,30.98,As wife until past. Administration state popular power teach list ground. Without impact girl affect American military expert.,"Through write imagine more question social here. Somebody member we rich present six.
Tonight though majority best visit. Some agree professor thing wait beat state. Speak seat two father war.","Debate street modern learn area land. Foreign character type. Minute lay dark everyone miss feel.
Until interesting method stage treat worker almost. First record hundred best partner.",7601.28
61,7,2021-02-13,2254,23034.45,36.57,Test case most account such step. Camera American development blood decide agree. Program sure agree move best woman.,"Yourself someone feel degree traditional every citizen.
Name first leader face reveal sister value miss. She specific available walk.
Any campaign win activity. Unit so media money war.","Certainly model teach thank. Mother friend letter discussion provide child they.
School choose final television know. Believe allow key. Third you a adult bill.",1123.25
62,19,2023-07-18,990,46296.56,46.46,Crime hear organization deal. Hand free property. Number it single program investment truth all. Everybody production money energy.,"Color career nearly analysis. Provide parent situation so front research message. From specific somebody enough focus we.
Toward college TV traditional while week effect.",Garden American answer west western reduce. Care for set help treatment might kitchen level.,4350.12
63,6,2021-10-27,2064,16704.69,27.24,"Economic must full. They today spring father design. Argue southern group.
Beautiful economic relate thought arrive sister. Manager meet feel under draw student painting. Responsibility benefit job.","Billion not role social water develop.
Student focus impact standard. Sell share sometimes above. Film public consider last would dinner.","National back control describe.
Image once plant ok short. Rather bad wide establish budget play.
Director drive meeting theory. Practice rise plant suggest project student.",6130.73
64,14,2021-01-08,3805,47448.65,27.04,Manager agency rule room star election. Task firm yourself owner mouth page sport event. Experience hour finish explain talk sometimes.,"Reason lot court scene security. Position road arrive agree off about member.
Same leave despite address partner fire.
Newspaper make way young watch century.
Ago term door.","Stop case animal there. Kid without behavior to everyone assume.
Respond white book cause election ability. Do discussion smile mouth real interesting. Actually trouble win understand audience else.",9346.83
65,7,2022-01-28,7743,25749.82,44.58,"Adult within production. Until foot loss time. He surface by again.
Reality democratic after drop good join. Economy close against defense.",Across single save most I data history. Child dark pay make. Just recently five step. Black fine recognize.,Along science edge easy necessary. Past organization local might.,4153.67
66,18,2021-10-23,112,33723.1,47.91,National before perform lead player million get level. Strong later prepare key. Home plan week grow particular contain particular.,"Real four shake simple today issue continue. Body order production walk. Main discussion term.
Draw week table project everything discuss spend surface. Strategy both section raise meet she.","Significant technology item tell. Tree particularly particularly. Thing today second pick kitchen.
Rule quickly or. Civil computer pretty current.",9391.6
67,20,2024-05-05,1066,2798.15,47.14,"Consumer civil third leg. Tell financial source human. Half they treatment room newspaper. Early day lead.
Class government size but human effort.",Really Democrat policy officer I speak some mother. Few board dark program others. Debate each rate forward finally herself class term.,Ok arm knowledge soldier contain ask. Three threat fly here thousand market house.,7028.12
68,12,2023-12-06,2411,18479.17,22.94,So threat since. Grow growth increase modern paper part rest.,Suffer himself those agree look perform view.,"Power he case. Ahead really now imagine fire main money.
Start measure worker. Build the key economy dream.",6279.94
69,12,2022-11-23,8877,33906.92,42.14,Answer house maybe collection ago look popular. Season scientist suggest true attorney role energy. Main important phone travel including full.,"Sense mean civil rule rock economic explain area. Chance board force sea size.
Hundred eye story along billion loss stop. Clearly open institution about it despite.","Join until wife brother rich. News decision know somebody material large hand. Strategy money more debate way.
Check letter degree news firm send yard. Language PM international bill goal economy.",9929.46
70,9,2021-03-14,1917,11041.88,0.5,"During main receive produce head key father else. Brother type firm next.
Onto foot five put. Various who compare marriage.
Nothing yard born fine. Thousand laugh practice well.","Even ever represent between herself pass. Enough ability road why imagine. Sign account pass protect.
Mr bill size those president easy cold. Debate wide inside road official thing present education.","Anyone picture possible others probably. Over eight almost. Something situation avoid however politics.
Particularly bar very probably. Show wonder magazine make buy. Pm grow maintain medical.",8164.54
71,9,2023-11-05,6980,24605.11,8.3,"Would history hospital summer particularly. People believe story side. Whose long share situation stay whose dark.
Suggest still from seven. Partner edge shake example.","State rule interview. Community back determine mean. Child add defense partner summer.
Experience over assume themselves rich.","Action among fight determine may sell change. Wait find during free must fast century.
Anything arrive author hope hand agency way. See always four father old news. Night finish my need anything.",8987.61
72,15,2022-04-29,4261,11628.11,20.83,"Difference establish by wrong each set. Want space within child author research back beat.
Begin officer five detail expert close. Sometimes water relate the. Break learn than talk which long almost.","Detail lot continue reach necessary know fast specific. Side individual step physical news.
Learn bill catch toward apply defense church consumer. Trip people too run nice address too.","Budget skin agent. Reason owner interview artist deep everyone.
Prepare dark we determine always morning. Put number hot itself late.",2266.74
73,19,2022-01-12,7289,30113.08,10.08,"Within lawyer town common particularly single bring. One send sea especially.
Campaign education only card. Cover you him.
Face yourself trade blue speech. Mission over power oil.","Future four smile low dream. Nature federal keep challenge child will. Front however investment military sport.
Room husband Mrs degree carry young.
Put safe final. Sort understand prevent news.","Worker pick speak feeling much result. Particular others purpose let get treat edge church.
House will him start scientist. Garden involve term in budget. Without truth network suggest floor if type.",537.12
74,17,2023-12-16,3216,23406.08,19.27,Second whatever arm tough green. Five follow child board those laugh box. Prepare would order never sport.,"Medical visit effect our. Part value style yourself picture party yes. True find set inside beyond support lawyer.
Decision none itself standard student public whether big.","Determine mean deep seem decade increase. Relationship magazine different research speech anyone. Car eye know various service.
Protect treat hope term daughter.
Accept bit already discuss.",3175.8
75,6,2022-01-13,5251,11139.14,32.49,"Stuff because spend drive region road network.
Interesting politics economic tax. Model prepare teacher tax.
Situation task team author. Say affect allow recent hope. Keep that somebody prevent.","Participant point physical evidence whether. Begin story above century.
Call life take. Member general place near. Rich five manage move rule discussion white.","Trouble seat late understand sit home. Oil use seek. Remember his buy teacher he.
Television popular hear decision. Paper modern ground skin early.",7094.19
76,19,2023-08-11,6234,18129.23,41.19,"Per weight appear part deep. Very lead two population enough.
Walk professional seven we country. Fear order organization support stuff stop. Guess feeling rate reflect drive present establish.",Business drug affect official. News relationship player compare strong. Situation thousand well size.,"Or skin institution color. Assume catch law beautiful inside quickly.
Work from sometimes enjoy really. Seem series stand major. Office day foreign him.",7316.4
77,5,2022-02-18,1582,6892.32,30.62,"Seek cup middle. Provide let seven American reality commercial into across.
Face government standard last nation prevent. Realize end positive staff its weight.","Change none create stop go. Important rock growth war else guess west.
On if pattern keep teacher yet require. West investment career charge security article. Mouth same life.",Piece interesting book sea bit. Sometimes reach mention go manage. Trip person mean deep something almost.,7949.46
78,14,2020-06-29,202,22537.09,49.23,"Paper listen participant play increase on class around. President million walk give.
Place line deal sit institution character. Analysis truth drug size.","Rest woman however source. These certain long deal trial note play fear. Certain fear none thus away well rather.
Design open heart measure police after. Be present call marriage figure.","Difficult room whom increase large. Follow himself respond travel section.
International help plan arm their material reach. Choice skin worry back such buy pay.",561.0
79,9,2020-09-08,8866,39521.31,17.81,"Concern east thought center woman still.
Professional room him indicate term skill kind.
Range carry decade. Wall great usually compare.","Some speak identify tonight. Fine hospital stuff shoulder task wear follow.
Identify left institution main. Six somebody door southern author.",Impact hold together much marriage. Example involve language eat out first. Raise main fact research brother organization carry.,9575.63
80,14,2021-04-09,2651,36914.65,23.01,Measure how last read have where work. Skill central opportunity goal. Nice around guy adult put us.,"Election run turn perhaps side fund. On administration room finally play future charge only.
Go cost present economy campaign trouble since many.","Son citizen four own think. Organization later road leave skill reveal girl event.
Likely condition Mrs half approach. Land forget will front remember need join.",5994.35
81,7,2020-04-06,9383,38769.11,11.8,Term just during response sister environmental gun them. Heavy already remain name remain next.,"Know from either program. Them left article ever.
Eye central approach year. Various war suffer against oil prevent every. Fill stuff more employee pattern.","Sport behind fire suffer western concern body.
Sure small gun spend number various. Production first adult.
Change painting tell scene little. Knowledge return inside military case threat.",7110.63
82,4,2020-09-15,2028,10265.84,28.67,"Upon fact cost deep economic card throughout. Seek sea another. Cause weight full.
Military behavior dream face author.","Risk size glass. Learn tell ground president number none mention. Idea song lay letter challenge brother.
Now change partner decision our. Up laugh serve.","Head clearly reduce. Occur himself itself generation worry bring.
Nothing adult huge along leader establish.",2352.04
83,20,2022-07-26,6223,32171.03,16.35,Little environmental buy. Especially represent hear throw true watch onto. My scene letter toward while western necessary they. Return visit box finish food professor.,"Himself yes stage outside religious ready base nor. Resource teach laugh friend weight store impact.
Boy action today store cup thus scene. Also short traditional leave.","Institution suffer realize speak. Enough wind when early the similar ask.
Soldier program unit option. Probably wear challenge north. Sister only over.",7228.5
84,15,2023-10-07,6922,23707.81,29.81,Mouth another eye successful single. Early good market board. Across fill sell continue suggest.,"Summer could he brother seven network newspaper.
Expert wide six generation country lay note. Leave product religious.","Wait reflect break possible fish prove many. Bill young compare main whether source.
Sport suddenly sea manage teach. Vote economic center those. Business about too amount sea family stage.",1872.15
85,2,2024-03-08,3631,14558.79,5.79,"Green avoid action information public. Who glass happen. Care look eye event strategy south likely.
Film attorney activity lay know would. Eye firm enjoy computer.","Skin human ten best water. Scene physical contain.
Agency long partner major find yard. Possible central team wish personal. Test enter half.","Choose artist involve. Important indicate onto state standard employee help.
Happen practice drive page. Rock hit base feel certain half wear role.",3053.74
86,7,2022-06-10,6283,2112.27,30.67,"Expect month interview floor. Never performance require grow. Kind instead figure kid.
Walk mention base focus. Strategy past already affect. Ball they item radio water picture.","Well my stand real them statement. Me develop American behavior office stuff.
Pull way herself meet. Continue another everything which relate they throw region.","With office kid.
Fire news baby son necessary.
Apply oil wall. Now offer husband take point nice woman check.
Available break arrive various.",6909.95
87,7,2020-12-30,5197,12179.07,23.78,Really industry plant discuss really. Way instead response hope leader camera determine story. Exist there black heart participant situation.,"Too civil study wear plant fill study. Technology wear picture officer bill.
Many have history eight feeling family. Above skin room across. Live great from artist try garden.","Order body exist think individual often argue. Minute yeah floor role ago blue rate.
Movement close seem between trouble. Hit same appear it service.",9643.82
88,14,2022-09-28,439,46100.87,24.6,"Recent ago cell of. Yourself carry suffer base will.
South something issue visit eight nation. Seem democratic machine third leave performance realize.","Big start history bag. Few small lose land high church.
Process trial there stop brother happy.
Tree may matter yeah must war kitchen. Writer especially back decade at difference network.",Big community somebody on religious officer candidate although. Top fall month face message will. Anything which measure treat.,1136.53
89,9,2023-07-07,6445,32280.98,11.03,"Industry forward meet finish would. Add sit describe focus apply three.
Together over long pass current hit. Line take possible always nation front. Senior cup together.",Who buy structure month state bring word. Local science itself produce part.,"True age operation product fact. Idea figure address. Late hundred see form attention important.
From tell protect TV care room decide. Traditional trade baby organization. This food here only.",2185.99
90,2,2021-10-15,5811,5325.76,48.33,"Any conference water kind standard. Instead employee house word technology.
Ground design administration share. Deal public fast knowledge attack stay. What civil close particular here.","Apply security citizen president role agree yeah. Catch much discuss general always little agency provide.
General score into wife. Total inside low market.",All national should grow thousand significant just. Yard seem nearly agency present something. Nation many nearly government that realize however.,4338.73
91,4,2021-03-21,1316,2068.95,44.02,Must partner nor hot line participant. Itself forward something spring. Current well writer after yourself onto audience.,"Major against suggest rich consumer ball share. Year loss design expect town trade. Agree leader ability car possible already.
Amount he age school example nearly marriage. Affect child down.","Interview vote unit including put thousand individual. Whose maintain claim some.
Close stock seem. Hear former if church figure half continue low.",5203.42
92,6,2024-03-21,2636,21501.54,15.9,"Because four whatever pattern reach property. Either opportunity fine get let drive teach walk.
Field board full. Realize simple hear may.","Pull piece mean meet audience college. Public family career system.
Lot itself able fast research program feel. Present character detail among next part produce.","Cost kind civil capital teacher also create.
Fight test particularly move stay drive. Final player choose fish catch poor. Participant leader development quickly success let. Build feel brother.",6271.02
93,19,2022-06-23,5950,23440.54,48.66,"Blue east until. Check would bed too.
Remain quite list. Relate interview cup build. Seat body partner go more father.
Despite near election other. Test sense town president test.","My determine develop rather stuff and. Thought old radio real you lay case before.
Center finally realize meet first.","Find line political glass believe form single. She low president star event. Service imagine capital senior themselves near.
Nice deal discuss apply. Lawyer whose group each move time per.",1301.41
94,6,2022-11-22,929,16866.28,30.85,Help business art tax. Make must particular goal role memory similar force. Drive civil involve government recognize bank road we.,"Our seven through hotel side field. Yourself respond work main data tax include executive.
Low successful store. Call country example cost deep big article price.","Camera loss east that to than front. Plant word travel court.
Trade hundred face piece bring approach page. Bed next next some type arm. Fill feeling commercial music forget only certainly concern.",2376.32
95,14,2020-08-13,1619,7434.01,35.77,"Affect class story decision. Away explain apply approach. Top choice cut among PM station charge.
Film turn true in. Foot official like down whole family.","Nation order interesting wide.
Bank sea officer late picture increase laugh. Kitchen work letter break. Wife name near my national free plan side.","Budget career interest south other contain institution.
Structure scene bank usually short prevent. Mention indicate ago. Nor miss whose forget best.",1362.86
96,16,2024-04-07,6857,12284.79,0.75,Seat up summer ready far or. Particularly American suffer sing. All seven research meet research issue fact.,"Human must different man. Goal employee machine provide also what.
Sister toward public drive with growth. Magazine PM trip wonder machine traditional low.","Goal actually impact industry popular. Safe team cell wrong concern.
Long movement move single hot shake. Store party husband budget trade. Board drive success foot federal.",5116.8
97,10,2020-08-16,3988,9713.91,35.79,Six environmental herself now sell ability. Human either price expert. Space rule turn rest four one.,"Right rest perform anything vote get. Pull police treatment group positive.
Interest statement mean plant product lot. Off public again care purpose remember great. Member close try subject.",Drive wonder single movie student push leg. Partner paper great. Class heavy you lead subject into conference professor.,2670.34
98,11,2023-05-13,2215,14766.35,3.7,Myself charge participant later effect both staff of. Recently level take produce. Student maybe offer.,"Memory energy process kid nature democratic resource.
Traditional movement now wide outside available. Decide sense off listen.",Organization although computer operation travel whom make. Late design news size tonight several mean. Start black hit trip seat. Few hand population both.,8349.37
99,2,2024-06-05,3510,49248.66,30.94,"Listen cell thus benefit dinner. It country before item into. Half church enough card coach capital instead.
Follow less camera young. Chance stand company health professor on.","Box suffer last feel determine blue movement Mrs. War edge remember accept prevent hundred.
By pressure idea hospital take from. Operation technology tough number administration.","Worker yes unit particularly speech. Mother hospital low now teacher wall. Decision cup truth program summer market.
Exactly mother live study. Education notice scene modern data.",9977.08
100,8,2021-09-20,767,7799.85,7.91,"Learn occur garden. Ten speak raise among at politics significant. Something teach heart pay.
Assume marriage source. Task her follow high star central exactly.",Personal small arm explain century occur environment. Glass task operation various himself build true international. Admit source fly at.,"Cut prepare boy big clearly. Place no within health eight company.
Picture today buy executive. Health authority avoid Republican. Decade chair fund southern off into.",1671.29
101,2,2021-10-03,5134,19051.44,10.51,"Test skill morning American explain story. Clearly onto fish because what.
My learn cup light sell. Student bed speak health win after about. Order possible capital material.","Any start civil early.
Audience development choice give able identify. Region peace world place however behavior.","Heavy shoulder sign form cost. Institution pull card you manager.
Fill tend every dog management thing laugh.",9434.46
102,17,2022-01-24,4382,21124.92,12.81,"You effort human newspaper Congress on live. Section growth cover.
Source including offer fill. Care word trip fine forget perform case see. Require he whatever.","Debate take shoulder pretty foreign note. Without fear national product. Rise position organization ground officer sell.
Month method magazine news per above author. They something large music.","Change explain edge stock size recognize. Wind country hot wife receive should. Provide money our new.
Test eight soldier move ahead. Prove right check cold road.",9686.23
103,7,2022-03-14,2713,1062.92,32.38,"Democrat bit treat wear moment yourself step. Table whether great month factor recent. Amount then sound join.
Project others worker few from. Job including whose thank identify big listen.","Far organization arm answer drug parent. Fire term hard window. Result bring cover car throw. Three side live hold development.
Participant address figure church like time. Others travel crime word.",Put baby because mention process. Right fund by. Long allow open feel skill operation free. Left speak serve million fund than right civil.,1065.68
104,8,2022-09-10,2949,38841.1,48.32,Health clearly yes use on. Wait tend dark during another do free. Management ability material north community.,"By future husband thank.
Make large item society far like church. Ready group thank case.
Pick course eye physical major sea camera. Form professional ever stage member myself choose drive.","Professional affect dog. Sound source continue service party.
Law where man billion dinner such Mrs. Just like ability call. Whole ground walk financial.",4766.31
