ProductGroupID,GroupName,Description,Category,SubCategory,CreatedDate,UpdatedDate,Status,IsFeatured,ImageURL
1,must,"Product product capital director. Speech about later represent know.
Decide bag friend. Before glass have cold technology.
Professional fall million sea appear. Never mean happy as.",Toys,Television,2021-11-05,2024-02-16,Discontinued,False,https://dummyimage.com/118x506
2,reveal,"Interest return nothing reality lot. View statement billion between above bank. Kind accept relate stage discover.
Car performance ball skin month. Crime left particularly however.",Appliances,Mobile,2023-04-18,2024-02-20,Active,True,https://dummyimage.com/118x941
3,likely,"Buy individual toward question great throughout best system. Town form again sport for she account. White my know positive travel several beat.
Range that director. Once than should degree.",Furniture,Mobile,2023-02-10,2024-05-19,Active,True,https://placekitten.com/317/360
4,continue,"Young by bill wind teach although. Never interview official particularly hundred tend.
Each official level president pass ago. Sound pull relate investment dark past central.
Read month business.",Furniture,Laptop,2020-10-23,2024-06-10,Active,False,https://placeimg.com/220/908/any
5,house,Very behavior feeling front however international. Station special house less subject room standard.,Books,Laptop,2024-04-18,2024-01-19,Discontinued,True,https://dummyimage.com/217x71
6,enjoy,"Indeed sure thousand. Recognize apply represent food yet rest middle outside.
More cold ability positive. Miss action lawyer factor security we likely. Economy why such speech.",Appliances,Camera,2020-06-16,2024-04-25,Active,False,https://www.lorempixel.com/457/116
7,month,Government each direction happy wrong house. Left you play while.,Appliances,Television,2023-02-23,2024-01-13,Discontinued,False,https://dummyimage.com/242x87
8,similar,"Site remain newspaper sea. Court music medical husband.
Those seek organization wind save. Book however risk field magazine. Free condition standard thing.",Toys,Television,2022-10-05,2024-02-20,Discontinued,False,https://www.lorempixel.com/862/725
9,court,"Food medical name natural exactly such trip. Career teach south.
School particularly account fear reveal. Know certain only other management fly nor. Contain concern grow car sea most.",Furniture,Laptop,2020-02-04,2024-05-02,Active,False,https://placeimg.com/12/839/any
10,age,"Fast accept child. Evidence white why.
Hour no also history note. Nearly those apply agent best. Force late whole might nearly.",Appliances,Tablet,2020-06-06,2024-01-09,Discontinued,False,https://placekitten.com/684/908
11,popular,"Feeling rich herself success consumer cold realize decade. Focus receive bad door.
At prove media work. Almost must charge me wife. Investment difference suggest church sit meet tend.",Toys,Laptop,2020-08-27,2024-05-13,Discontinued,False,https://placekitten.com/387/563
12,single,"Market culture rather item same politics record. Draw system to term. Either term each throw from per.
Past pressure someone reality. List either arrive ahead process.",Furniture,Laptop,2020-08-11,2024-01-17,Active,False,https://www.lorempixel.com/345/456
13,who,"Audience place after lose. Usually four small everybody maintain technology seven. Couple industry outside back what.
Record speech impact for. Grow involve better act.",Furniture,Mobile,2020-01-20,2024-04-23,Discontinued,False,https://www.lorempixel.com/194/532
14,loss,"Foreign other physical own oil. Style special word several.
Yes discuss above yeah weight. Natural maintain provide field.",Books,Camera,2021-03-25,2024-04-03,Active,False,https://placeimg.com/531/570/any
15,what,"Medical Republican medical light increase.
Still you heart four receive education decade quite. Process beyond fly little main a student.
From cut difficult. Daughter join manage line.",Books,Laptop,2023-01-04,2024-05-30,Discontinued,False,https://dummyimage.com/93x482
16,parent,"Allow may challenge such adult place life. High then central.
Understand safe toward enter cup early.
Baby bit later message land big recently. Make product analysis.",Furniture,Tablet,2023-08-10,2024-04-24,Active,False,https://placeimg.com/393/173/any
17,traditional,"Become management ready ever mention. Common foot leave man nature he employee.
Painting as fine most. Reduce particular compare can about industry. To forward teach keep catch.",Books,Mobile,2023-07-14,2024-03-21,Discontinued,False,https://www.lorempixel.com/77/410
18,research,Way throughout much including instead. Truth employee image.,Appliances,Television,2023-12-16,2024-02-16,Discontinued,False,https://www.lorempixel.com/75/798
19,million,"Save security agreement popular. Ago prepare relate mouth compare radio continue. Me movie various past.
Color into strategy push fact can. Assume play author morning test. Bank rich begin the.",Books,Tablet,2021-02-20,2024-05-09,Discontinued,True,https://placekitten.com/930/298
20,career,"Weight return fast little environment send.
International guess suffer learn. Impact pick total per without as economy.",Appliances,Tablet,2021-03-23,2024-01-03,Discontinued,True,https://placeimg.com/838/354/any
21,enter,"Break deal several talk happen term change section.
Seven throughout factor ball owner. Be prevent eat boy. Sister leave must job into world listen scientist.",Electronics,Laptop,2021-09-18,2024-05-12,Discontinued,False,https://placekitten.com/475/355
22,foot,Resource somebody whom become that step cold. Program talk themselves morning nothing where ground.,Appliances,Mobile,2021-06-12,2024-01-05,Active,False,https://dummyimage.com/588x602
23,commercial,"Right it experience cell turn. Need ready all professional.
Benefit full nearly. Management little after home. She main cultural bad.",Furniture,Tablet,2020-07-29,2024-05-02,Active,False,https://placekitten.com/727/17
24,particularly,"Blood too game number artist. Clearly hot table customer cover structure and.
Stay about town better anyone you consider stop. Peace establish move worker expect player meeting.",Books,Television,2020-04-20,2024-06-12,Discontinued,False,https://placekitten.com/543/551
25,decision,Foot red I add. Instead president next whether next recognize ago. Upon cell morning reach.,Toys,Camera,2023-08-22,2024-01-03,Active,True,https://placeimg.com/137/508/any
26,thought,"Movement relationship color ok. See capital quickly. Girl research issue though. Until behavior they occur.
Any mission smile low national contain. Prepare cup bring everybody.",Appliances,Laptop,2022-06-23,2024-04-07,Active,True,https://placeimg.com/619/386/any
27,phone,"Become ability analysis. We rate alone eat each organization away.
Old partner degree him. Bring game commercial few ability remember ten. Art draw stay story soldier.",Furniture,Tablet,2020-06-12,2024-05-31,Discontinued,True,https://www.lorempixel.com/830/509
28,time,"Level dark thing so between total. Collection little set benefit increase size beautiful this.
Attack media number news. Fire process usually daughter light nor as.
Space film sit.",Toys,Laptop,2023-08-08,2024-02-24,Active,False,https://placekitten.com/452/509
29,conference,Perhaps force type east policy law. Affect wife seek. Control article often take time.,Electronics,Television,2022-02-11,2024-06-01,Active,True,https://www.lorempixel.com/549/224
30,enter,"Again term close affect close action without him. Both sport training able range toward.
Until meet learn can. Task unit democratic however blue project.",Electronics,Camera,2024-06-10,2024-03-20,Discontinued,True,https://placeimg.com/359/731/any
31,personal,Mrs century site few board treat girl. Off collection financial health still easy.,Toys,Camera,2021-10-10,2024-02-20,Active,True,https://placekitten.com/35/279
32,thousand,"Land deep often other. Management truth early partner. End development perhaps.
Trial record western series test.
Class take sort talk star rather. Between energy shoulder sort second owner manager.",Appliances,Laptop,2020-03-30,2024-03-01,Discontinued,False,https://placekitten.com/678/136
33,modern,"Prevent suggest world laugh page. Be person thank hour. Need game outside across specific real.
Writer themselves low evidence career. Kid music parent together college share.",Toys,Camera,2023-09-14,2024-02-27,Active,False,https://www.lorempixel.com/929/853
34,decide,"My medical person upon myself carry all. Doctor firm certain role executive protect. Computer art since own.
His since me expect drop happy. Piece guy action really address expect trouble.",Furniture,Mobile,2020-06-23,2024-05-22,Discontinued,False,https://www.lorempixel.com/681/262
35,everyone,"Blood later hotel protect fill door three. Party central but office them check white.
Speak us magazine pass future decision authority.
Option clear choose draw job hundred.",Electronics,Tablet,2024-02-21,2024-05-27,Discontinued,True,https://www.lorempixel.com/101/560
36,wear,"Buy it scene law. Situation name him defense various. Picture less baby north energy.
Heart official coach service successful her live. Much above leave note.",Books,Television,2022-01-04,2024-02-25,Active,False,https://dummyimage.com/467x430
37,majority,"Participant to gas single. Once market before everybody. Perform after report collection level despite staff.
Election rather she discover maintain yet beautiful believe. Reveal structure them big.",Furniture,Television,2023-03-20,2024-05-26,Active,True,https://www.lorempixel.com/96/665
38,hot,Nearly certain at prepare town. Have over sign morning tree. Congress effort cold daughter often personal.,Appliances,Tablet,2021-11-03,2024-06-08,Discontinued,False,https://placeimg.com/473/620/any
39,reality,They race suffer include show them single get. Whole style police it few. American feel entire open.,Appliances,Laptop,2021-09-01,2024-06-16,Active,False,https://placeimg.com/102/787/any
40,low,"Describe account police name bill. Build particular too himself his leader painting. Account involve air significant drive.
Art daughter tree final note fund third. Something family water prevent.",Books,Television,2020-01-20,2024-02-15,Active,True,https://www.lorempixel.com/204/432
41,trouble,"List nation attack thus can. Quite too we movie near note.
Great hold worry finish. For arrive process possible marriage majority area. Field trial strong. Claim beautiful reason remember.",Appliances,Mobile,2022-09-30,2024-01-12,Discontinued,True,https://dummyimage.com/947x909
42,peace,"Sing friend force smile accept by. After get room which. Day including involve.
Star film quickly shoulder. Month course goal some.",Furniture,Laptop,2021-06-02,2024-04-30,Active,False,https://dummyimage.com/147x307
43,easy,"Hear name who start seven base oil. Minute speak somebody start state control.
Usually want magazine piece surface try. Remain reach network green. Western marriage week professor drop him him.",Books,Television,2021-07-01,2024-06-20,Active,True,https://dummyimage.com/858x409
44,machine,Door next those result official people add. Garden yard section camera environmental. Example stuff pressure allow capital.,Appliances,Tablet,2024-01-13,2024-04-21,Discontinued,False,https://dummyimage.com/105x508
45,behavior,Pay performance sing man. Go federal group sure skill young including court.,Appliances,Camera,2022-08-03,2024-04-05,Discontinued,False,https://www.lorempixel.com/102/492
46,behavior,"Level high personal be authority must. Even attention measure why perform eye.
Put point dark shake head find single.
Off garden better by for medical growth. Recently clear parent film that.",Electronics,Camera,2022-03-01,2024-02-03,Active,True,https://www.lorempixel.com/174/939
47,piece,"Another successful buy than. Between us guy career Congress into although.
Early check time minute site present. Yes time attack if few voice. Sort live claim argue should room report.",Electronics,Camera,2021-11-17,2024-01-03,Discontinued,True,https://placeimg.com/376/820/any
48,wish,"Simple their must. Heart ability last eight. She partner source staff. Happy soon ahead mission peace wind.
Artist kid investment five near.",Furniture,Mobile,2023-05-09,2024-05-24,Active,False,https://dummyimage.com/232x540
49,establish,Mission manager why successful. Group fear federal reveal black. Most able one light eight.,Toys,Mobile,2023-09-12,2024-04-11,Discontinued,False,https://placekitten.com/58/196
50,they,Agent generation write establish each. Their decade time perform idea keep approach ever. Thousand recognize under church ever amount get.,Books,Camera,2022-03-19,2024-03-29,Active,False,https://placekitten.com/16/214
51,out,Million his total charge anyone know. Evidence bad item start teach. Use nation father movie professor Republican.,Toys,Mobile,2020-07-03,2024-06-14,Discontinued,False,https://placekitten.com/125/947
52,deep,"Idea cover economy campaign keep. Anything message have.
Low per campaign whole. Of difficult west people.
Knowledge same data window student ball develop. Four meeting camera interest coach heart.",Electronics,Tablet,2021-06-08,2024-02-04,Active,False,https://dummyimage.com/279x745
53,there,"Build money let everyone lot.
Leader democratic small. Smile dark amount. Series industry garden himself.",Electronics,Laptop,2023-07-17,2024-04-30,Active,True,https://placekitten.com/912/1013
54,sing,College anything involve north never investment model. Machine red soon town. Between cut foot consider.,Furniture,Television,2020-08-27,2024-04-01,Active,True,https://placekitten.com/1018/705
55,imagine,According hour energy ball police. Air southern series nor certainly. Skin old various capital process phone. Gun consider maybe impact.,Electronics,Tablet,2022-10-19,2024-01-17,Active,True,https://dummyimage.com/786x508
56,produce,"Five same write pressure peace. Officer PM trouble song. Expert kid my say church now energy data.
Party maintain range their account shake interview.",Electronics,Camera,2024-03-01,2024-04-10,Active,False,https://dummyimage.com/841x288
57,box,"Talk simply pattern color speech a.
Meeting market your board social. Grow executive toward property particular strategy.",Books,Camera,2023-12-15,2024-04-22,Discontinued,True,https://dummyimage.com/98x677
58,woman,Structure debate sign current military ball size for. American everyone everybody technology interest skill receive audience. Deal investment standard.,Furniture,Television,2020-09-22,2024-03-25,Discontinued,False,https://dummyimage.com/986x492
59,arrive,"Low difference computer find professional almost so. Paper bag service blood sign address.
Scene almost develop company firm game. Choice consider happen.",Toys,Television,2021-09-13,2024-03-01,Discontinued,True,https://placekitten.com/316/418
60,appear,"Material take able likely.
Word size light ok. Onto always population director interview spring wait.",Appliances,Tablet,2020-09-30,2024-06-06,Active,True,https://dummyimage.com/912x813
61,key,Structure strategy base suggest. Generation brother Congress stock. Quite network investment wife where.,Books,Mobile,2021-01-10,2024-04-18,Active,True,https://dummyimage.com/729x880
62,center,Adult their quickly section character ball to. Start opportunity happen compare less already whom.,Toys,Laptop,2022-09-12,2024-01-26,Discontinued,False,https://dummyimage.com/571x571
63,size,"Question day subject use exist short. Can visit important Mr.
Person outside sing trade control professional these. Believe body term. More body Mrs color break.",Toys,Tablet,2021-07-21,2024-05-14,Active,True,https://placeimg.com/499/852/any
64,several,Wear personal word debate if school produce occur. Recent soon medical nothing remember still common couple. Magazine find senior memory offer whether.,Electronics,Laptop,2021-06-04,2024-06-10,Active,False,https://dummyimage.com/309x185
65,to,"Still only church care note may near. Different movie week necessary space.
Crime perform imagine question. Stock network hear loss spring buy pull. Little voice between.",Toys,Camera,2021-02-18,2024-04-25,Discontinued,True,https://dummyimage.com/677x39
66,hit,Play write free suggest plant all. Mind against walk tell. Compare month structure stage deal.,Books,Tablet,2023-07-01,2024-02-07,Active,False,https://placekitten.com/798/366
67,to,"Democratic pass score several somebody. Mr perform bit number building animal his.
Away thought impact own ever. Former sing past risk Republican. Policy still rock book thought physical.",Toys,Laptop,2020-10-24,2024-04-06,Active,False,https://placekitten.com/436/901
68,mean,East kitchen create rock participant entire song. Describe sell over special participant enough agree. Customer talk relationship budget himself.,Appliances,Laptop,2020-02-21,2024-05-04,Discontinued,True,https://placekitten.com/473/196
69,face,"Several crime wall sign increase believe already.
Move walk common set well phone. More woman husband company statement. Safe page social significant.",Appliances,Laptop,2024-01-02,2024-04-23,Active,True,https://www.lorempixel.com/857/394
70,five,"Goal help range huge part around within. Size fight coach term rock. Media simply street maintain report popular catch.
Land police science fight lose. Popular if discuss our most.",Electronics,Laptop,2023-06-25,2024-05-10,Discontinued,True,https://dummyimage.com/684x741
71,pattern,Quickly she religious. Sport nature series law join well politics. Too act wrong miss rock.,Books,Mobile,2021-09-04,2024-05-13,Discontinued,True,https://placeimg.com/617/84/any
72,machine,"Really my age continue too behind month film.
Growth bag ground must nothing month that past. Citizen claim PM hope. Organization accept although part bring quickly forward.
Art analysis order.",Furniture,Laptop,2021-12-07,2024-06-15,Active,False,https://www.lorempixel.com/22/413
73,writer,"Necessary nor mind. Property admit trip together agency enjoy. Commercial rich music its movement daughter.
Nor himself a.
Drug head order bank glass benefit small. Partner live religious even city.",Furniture,Laptop,2024-04-19,2024-04-04,Discontinued,False,https://placekitten.com/762/868
74,check,People around it style growth detail put. Than recognize cover better how. We trial into politics.,Furniture,Camera,2021-05-01,2024-05-06,Discontinued,True,https://placeimg.com/249/191/any
75,billion,"Him fire might identify wish glass. Test fish far dark continue player.
Generation clear develop husband himself. Effort reveal father new summer save when actually.",Appliances,Camera,2024-02-19,2024-06-08,Active,True,https://dummyimage.com/153x124
76,foreign,"Full none few since star.
Design into nor. Individual lose thing improve according leader produce food.",Books,Laptop,2023-08-08,2024-06-02,Active,True,https://www.lorempixel.com/408/109
77,race,"Road down partner past remember. Place me impact mind fast.
Edge contain economy that price night idea. Total main organization certainly both want his. Hundred under sport animal bad.",Furniture,Camera,2020-02-13,2024-04-14,Active,True,https://placekitten.com/923/701
78,cultural,"Response tell garden minute color entire. Read seven range seat player rate.
Guess college room not. Thousand lead care some bank.",Books,Mobile,2020-03-06,2024-05-18,Discontinued,True,https://www.lorempixel.com/782/522
79,management,Plan avoid over five man. Development bad front already team these just. Watch property form much close development. City respond adult maybe teach.,Electronics,Camera,2021-02-10,2024-02-17,Active,True,https://placeimg.com/854/103/any
80,term,Grow letter eat open training arrive. Establish minute side threat wide only will. Dream audience wrong father reality us main. Hair build instead history war.,Electronics,Mobile,2020-06-23,2024-06-09,Active,False,https://placekitten.com/126/637
81,necessary,Understand over foreign garden make. People property glass range cover action. Agent against old oil war through project.,Appliances,Tablet,2023-01-20,2024-01-28,Active,False,https://placekitten.com/386/868
82,interest,"Case benefit today provide other half find. Customer house physical front include type yard talk.
Window whatever quite. Site management attorney drop.",Electronics,Tablet,2020-11-28,2024-03-30,Discontinued,False,https://placekitten.com/174/686
83,ten,Reality learn analysis population. School deep rise ever scene budget design. Deep power Republican education ground though particular.,Books,Television,2021-03-11,2024-03-15,Active,False,https://placeimg.com/775/634/any
84,as,"Heavy turn bill. Sit improve blood art blue door. South end eat nor.
Fall public according dog service prove however rock.
Process everybody range big know level.",Books,Laptop,2023-07-05,2024-01-28,Discontinued,True,https://placeimg.com/244/671/any
85,nice,"Process blood evening community old institution language. Perform late make.
Service improve imagine skin gun speech. War material per school painting.
Car cause discover among fact difficult.",Books,Tablet,2020-11-30,2024-01-14,Active,True,https://dummyimage.com/197x547
86,subject,"Expert commercial sense task over by. Mission me tend fly modern could court sea.
Before address often everything. General forget from exist. Indicate require eight.",Appliances,Camera,2024-05-13,2024-06-06,Active,False,https://dummyimage.com/163x135
87,like,Heavy remember reality significant your product show. She physical hotel politics someone one business. Their hot green real ago. Price I every thousand task foot benefit.,Electronics,Camera,2020-07-22,2024-06-16,Discontinued,False,https://dummyimage.com/837x717
88,medical,"Paper listen pattern.
Staff though method lawyer create. Sea tree inside especially sport. Picture pressure cup example cell.",Appliances,Camera,2023-08-04,2024-05-28,Discontinued,False,https://placekitten.com/51/185
89,social,"Although rest perhaps red. Physical Republican federal leave join.
Can film night camera. Similar Mrs another investment. Morning arrive color situation create often program.",Toys,Tablet,2021-06-05,2024-03-20,Active,False,https://dummyimage.com/138x993
90,material,City near century growth officer. Although yeah know already pass. Page surface Congress article fact.,Electronics,Camera,2023-08-18,2024-01-29,Active,False,https://www.lorempixel.com/852/439
91,century,"Left could mind. Wait difficult figure break thousand season cup summer.
Piece month four sing bank up. Industry democratic itself where message expert. Month why despite important.",Appliances,Camera,2023-04-16,2024-05-11,Active,False,https://placekitten.com/866/451
92,themselves,Local offer under throw serve generation. Year beat you garden base. Government network become senior it build.,Electronics,Camera,2021-06-20,2024-02-12,Active,False,https://www.lorempixel.com/102/384
93,strategy,"Conference campaign answer color too mention.
Relationship call market official her catch wait process. Rule often agent us generation.",Appliances,Laptop,2024-06-18,2024-02-12,Active,False,https://dummyimage.com/91x974
94,cell,"Per light fire degree foot continue. Figure difference voice wish effect.
With far turn policy wait mission. Property agreement fire loss far realize.",Electronics,Mobile,2022-01-25,2024-01-21,Active,False,https://dummyimage.com/596x144
95,group,"Occur pass society attention night. Themselves employee article project.
Believe and economic region loss wait technology.",Electronics,Mobile,2021-11-11,2024-06-11,Discontinued,False,https://dummyimage.com/310x554
96,responsibility,Still question so hundred action born. Among but partner increase too force trouble detail. Positive figure company seat usually police.,Books,Tablet,2021-08-27,2024-02-11,Active,True,https://placekitten.com/685/1013
97,case,"To scene employee citizen set law. Try upon Mr customer boy big.
Respond like produce guy fear test. Dinner street pass fight. Miss bar difference expert.",Electronics,Camera,2022-07-23,2024-05-19,Discontinued,False,https://dummyimage.com/579x996
98,enough,What apply evening our writer thought exactly. Actually amount plant never probably. Wonder particularly perform know.,Furniture,Television,2021-05-22,2024-06-08,Active,True,https://www.lorempixel.com/756/302
99,Democrat,Interview available behind. Training collection challenge several. Raise democratic old dinner vote simply shake.,Books,Tablet,2022-02-03,2024-03-18,Discontinued,False,https://dummyimage.com/729x602
100,color,Usually herself often protect once write tough hour. Natural look sell environmental land. Finally soon possible agree there pattern.,Books,Laptop,2023-10-19,2024-03-06,Discontinued,False,https://placekitten.com/887/89
101,both,Middle vote cover road without. Tough business probably deal face. Business everything perform under daughter.,Electronics,Mobile,2020-07-03,2024-02-03,Active,True,https://dummyimage.com/454x725
102,economic,"Whose far book beautiful. Half mission power shoulder. Issue central bill wonder quality strong.
Organization baby east church point our. Single ability compare seek.",Appliances,Mobile,2022-03-08,2024-04-10,Discontinued,True,https://placeimg.com/46/747/any
103,guy,"Room land now. Represent kid need generation parent. Media attack lawyer piece when.
Election give again group half north mean protect.",Appliances,Television,2021-11-11,2024-03-22,Discontinued,True,https://placekitten.com/310/490
104,war,"Buy eat particular her determine. List least near movement.
Child line game professional want Mrs not experience. Security message already draw personal. Relationship trouble ahead most clearly.",Toys,Camera,2023-07-23,2024-05-31,Active,False,https://placekitten.com/721/605
105,heavy,"Race town ago skin need group. Movie business activity TV which. Lot billion candidate financial.
Owner possible low hospital sort whatever fire discussion. Bad cold full social need attorney.",Books,Tablet,2022-11-16,2024-04-08,Active,False,https://www.lorempixel.com/370/212
