ProductGroupID,GroupName,Description,Category,SubCategory,CreatedDate,UpdatedDate,Status,IsFeatured,ImageURL
106,keep,"Campaign become image hold. Drop break say research source.
Writer onto eye.
Deep in world national nation. Course general actually hotel simply. Pass door response remain serious.",Appliances,Mobile,2024-04-03,2024-02-12,Active,False,https://placekitten.com/327/490
107,it,"Course want memory want. People model share create sort.
Try culture no put discover teacher Republican. Kitchen lawyer hard.
Anything born floor amount.",Books,Television,2022-12-04,2024-02-06,Discontinued,True,https://placeimg.com/446/17/any
108,design,"Forget accept spend agreement guess not right player. Voice artist stuff build.
Unit make gas form talk success. When class ten hold particularly no.",Furniture,Tablet,2021-02-02,2024-01-23,Discontinued,True,https://placeimg.com/326/910/any
109,large,Guess color say simple car. Meet ahead place include. Every by onto lawyer weight provide pretty hard.,Toys,Tablet,2022-02-22,2024-01-27,Active,False,https://placekitten.com/649/352
110,already,"Lay over hand visit minute. Wish bit close.
Yet trouble reflect age just. Necessary from be since learn. Audience pretty example education raise choice factor.",Books,Laptop,2023-02-09,2024-05-06,Active,False,https://dummyimage.com/706x1006
111,return,Car course be staff unit also place. Thus choose fund assume personal. Much hear theory room region home candidate natural.,Toys,Camera,2020-07-20,2024-02-01,Active,True,https://www.lorempixel.com/672/323
112,figure,"Will move door adult season hope memory. Whole pass reflect since.
Top try side term forget public. Meeting maintain culture why relate if.",Electronics,Laptop,2023-10-06,2024-04-10,Discontinued,False,https://www.lorempixel.com/375/525
113,free,"New director notice next subject stuff environmental. Win per better model.
Purpose late type group. Production remain see keep. Pass tax participant. Where military buy to very.",Books,Television,2020-12-17,2024-05-22,Active,False,https://placekitten.com/418/84
114,place,"Animal fight others picture see. Suggest will body somebody. Different poor movement spring executive third something.
Too player expert camera manage nation maintain. To several operation exist.",Electronics,Television,2020-12-09,2024-02-11,Active,True,https://placeimg.com/653/442/any
115,house,"Cup source can establish free resource. Book result begin speech pick upon.
Brother hand determine white. Read provide stock significant woman late second down.",Books,Tablet,2024-01-09,2024-05-17,Discontinued,False,https://dummyimage.com/105x746
116,write,"Bill bad shoulder recent. Open decide glass author threat sort.
Interesting very large evening staff despite. Responsibility season tough buy chance president story paper.",Books,Laptop,2021-08-29,2024-03-09,Discontinued,True,https://placeimg.com/912/359/any
117,newspaper,"Us role almost military know. Upon Republican floor begin. Game dog leader.
Enough for short culture. End single finish information American.",Appliances,Laptop,2023-03-31,2024-02-06,Discontinued,False,https://dummyimage.com/814x423
118,piece,"Company political sit window herself race institution. Media prevent every support risk product.
Brother attorney arrive up. Everything western once coach same lawyer certain.",Appliances,Laptop,2021-05-29,2024-04-17,Active,False,https://placeimg.com/761/534/any
119,peace,"Activity risk find me evidence walk. Manager ask car low history.
Threat doctor song best.
Theory letter training beat whether best. Right girl institution sell. Power mouth far wind success media.",Appliances,Laptop,2022-08-24,2024-05-18,Discontinued,True,https://placeimg.com/872/571/any
120,great,Option themselves employee although. People painting conference also agent foot. Seek common contain technology enjoy find religious. Road set campaign simple bit.,Furniture,Camera,2022-02-21,2024-02-21,Active,False,https://placeimg.com/386/906/any
121,mean,Strategy station doctor apply. Anything change west.,Books,Laptop,2024-02-19,2024-01-08,Active,False,https://placekitten.com/57/196
122,tough,Sometimes wife child child answer together. Clearly visit building more however leader unit score.,Books,Camera,2020-03-24,2024-02-11,Discontinued,True,https://dummyimage.com/56x757
123,view,"Success poor size fund huge shake me. From evening capital. Age throughout American art reach easy. Grow wish use seek back.
Answer bar detail onto forget. Hot record deal sort.",Books,Television,2021-03-27,2024-02-25,Discontinued,True,https://placeimg.com/198/589/any
124,happen,"Father include its miss. Teacher none toward weight personal national like.
Paper get walk career language result race. Work little individual risk.",Electronics,Tablet,2024-02-27,2024-02-26,Active,True,https://placeimg.com/423/179/any
125,factor,Carry generation bit consider line. Several dream recently standard language since manage state. Those week on nor themselves far. Level nothing language policy.,Electronics,Camera,2021-10-09,2024-03-03,Discontinued,False,https://placeimg.com/769/496/any
126,mean,Success quality determine none range suffer. End century end parent and off. Mission oil run few American.,Electronics,Laptop,2023-07-07,2024-03-02,Discontinued,False,https://dummyimage.com/166x988
127,middle,"Soon player hear choose environment different grow. It go performance yard explain cut.
Campaign or professional police with authority. Improve civil think than word brother attention.",Electronics,Mobile,2024-02-23,2024-02-14,Discontinued,True,https://placeimg.com/308/711/any
128,Democrat,"Model open all develop husband impact until billion. Look president himself top those local. Raise offer act.
Oil pick huge him. Spend purpose light now discussion successful.",Books,Television,2021-04-06,2024-01-26,Active,False,https://placeimg.com/97/710/any
129,when,"Answer seven society animal body news. Win buy enter seat green theory food.
Key break plant tax mention area suddenly. Nation light organization service hospital moment.",Toys,Camera,2024-05-10,2024-02-08,Discontinued,True,https://www.lorempixel.com/380/834
130,be,"Arrive back summer four radio. Believe entire meeting reveal party painting star by.
Meet analysis option bag. Spend pattern animal it price.
Hour deal direction as middle officer minute.",Electronics,Camera,2023-08-01,2024-02-18,Active,True,https://dummyimage.com/416x122
131,century,"Share deep on form.
Significant possible conference matter describe well up. Effect green close guess.
Along impact thing former way officer green. Defense three Republican.",Appliances,Camera,2024-06-08,2024-05-30,Discontinued,True,https://www.lorempixel.com/8/628
132,measure,Three green civil every him. Moment health human above head quickly. Officer property machine bill audience three.,Furniture,Television,2021-01-18,2024-03-30,Active,True,https://placeimg.com/460/442/any
133,reality,Positive hear fund improve behind. Budget president purpose even. Sport outside road effect final blood person.,Books,Mobile,2023-04-22,2024-02-09,Discontinued,True,https://placekitten.com/485/766
134,can,"Little certainly movement their draw none serious. Safe truth particularly just against inside.
Structure goal ready when only idea after. True natural case among on.",Toys,Mobile,2021-10-10,2024-05-08,Discontinued,False,https://placekitten.com/988/205
135,probably,"Scene writer enter doctor a only. Contain book resource. Shake realize able.
Dream list father design. Natural feel rich business. Particular own turn section them.",Furniture,Laptop,2020-12-24,2024-04-26,Discontinued,True,https://placekitten.com/57/499
136,future,Allow plan condition discuss phone. Would discussion form Mr similar. Agent form bad fill make process. Letter occur church trial.,Books,Mobile,2020-07-03,2024-05-22,Active,False,https://www.lorempixel.com/127/664
137,case,"Science mother so agency mind anything grow opportunity.
Gas her concern first. Point admit rest turn. Training theory Democrat compare town me son.",Appliances,Mobile,2022-12-17,2024-02-18,Active,False,https://placekitten.com/944/920
138,same,"All huge baby policy need safe. Work upon program story everyone.
Change happy animal certain future drop but. Every because former.",Toys,Laptop,2024-05-08,2024-02-06,Discontinued,False,https://placeimg.com/628/860/any
139,part,"Develop debate west up father thousand. Manager tree of board account.
Understand most art system view wonder.
Loss other life power young.",Toys,Television,2021-06-26,2024-01-06,Discontinued,False,https://placekitten.com/258/33
140,consumer,"She consider property rule economic cup society. Speak parent parent professional.
Myself do prepare consider kitchen popular range. Wear kind any.",Books,Mobile,2022-02-08,2024-02-06,Active,True,https://placekitten.com/883/759
141,we,"Group operation future sport.
Fish parent allow sport several probably. Enough specific black perhaps.",Furniture,Laptop,2020-09-21,2024-01-14,Discontinued,False,https://placeimg.com/862/571/any
142,run,"Natural nice difference event. Next energy once room worker. Economy above act see.
Idea pick impact business window across here. Receive expect ever lose. Us listen budget candidate.",Books,Tablet,2020-04-02,2024-01-02,Active,True,https://www.lorempixel.com/770/130
143,civil,"Budget a per. Item together thank guy government.
Line suddenly probably wife several. Television hour fast rule young spring. Food treat indeed large rich risk.",Furniture,Mobile,2024-02-21,2024-02-29,Active,True,https://placekitten.com/710/422
144,third,Training door near government market truth market. Care exactly somebody free language actually about but. Seven wide article doctor address. Yes because expect support.,Furniture,Television,2020-12-20,2024-01-20,Discontinued,True,https://www.lorempixel.com/90/672
145,shoulder,Sense lay present whatever for information loss. Try great perhaps floor word finish high. Value scientist good wrong. So couple center eye.,Electronics,Laptop,2022-11-22,2024-01-12,Discontinued,True,https://placeimg.com/892/1020/any
146,spring,Serious leader program son. Always ball effort. Reason rate hit from.,Electronics,Mobile,2020-04-12,2024-02-23,Discontinued,False,https://placekitten.com/564/371
147,middle,Media leave social positive degree role. Effect risk official thank. Process strong field kitchen window.,Appliances,Tablet,2020-10-14,2024-01-13,Active,False,https://dummyimage.com/636x1009
148,page,"Most its film language audience look increase. Effort major can.
Establish skin concern final. Month word should day language address.",Electronics,Tablet,2023-06-04,2024-05-16,Discontinued,False,https://dummyimage.com/643x958
149,pay,"Remain she child leg.
Natural century save election. Week success customer.
Young one very drug news during. Some decade air item notice Republican.",Furniture,Mobile,2023-01-01,2024-05-26,Discontinued,False,https://placeimg.com/348/921/any
150,especially,"Summer show player begin care.
Nice campaign clearly hope road trade yard day. Bed produce item. Personal owner candidate throw decade.",Books,Camera,2020-06-19,2024-02-23,Active,True,https://www.lorempixel.com/182/921
151,fight,Change hundred challenge sound especially authority. Note single friend out travel sea figure outside.,Appliances,Television,2022-03-19,2024-06-10,Active,False,https://placekitten.com/993/926
152,third,"Relationship section from manage. Be lot unit whose.
Remain job strategy often analysis space debate. Simply where within point. Share single government machine crime result.",Books,Tablet,2021-10-11,2024-02-04,Active,False,https://dummyimage.com/1007x526
153,loss,"Only toward draw of live. Member kind foreign instead full whether.
Environment my game. Community off region me sense theory.",Electronics,Camera,2020-10-23,2024-04-21,Active,True,https://placeimg.com/755/533/any
154,magazine,Heart participant represent audience. Reflect study forget general mission Congress budget heavy.,Toys,Tablet,2022-10-09,2024-01-20,Discontinued,True,https://www.lorempixel.com/489/508
155,wear,"Knowledge quality quality ground worker future. Table pattern factor arrive.
Store they push interview wind. Official her professional fly worker pattern.",Furniture,Mobile,2023-06-16,2024-05-07,Discontinued,True,https://placeimg.com/493/543/any
156,also,Home body hand whatever enough road. Individual hand war power ever great. Democratic painting usually consumer. Would bank finally.,Furniture,Tablet,2024-02-07,2024-01-04,Active,True,https://www.lorempixel.com/217/532
157,food,"Bed arrive response present newspaper sometimes. Our few step way employee. Body perform easy water some street know.
Experience point trip they truth outside foot. Action want hit street.",Appliances,Tablet,2020-06-06,2024-01-20,Active,False,https://www.lorempixel.com/259/821
158,condition,"Woman feel boy. Arm above everyone energy large front describe country.
Note add she. Somebody sport goal center well imagine around. Camera professional far son.",Toys,Television,2022-12-21,2024-02-28,Active,True,https://www.lorempixel.com/420/835
159,its,I decade house only store defense expect. Student prevent land media particularly certain discover.,Electronics,Mobile,2020-10-01,2024-02-19,Discontinued,True,https://placekitten.com/417/496
160,tough,"Similar serious their while notice front more name. Occur lead lead program word.
Student education word just community. Early civil then notice nice.",Books,Camera,2021-02-15,2024-02-04,Discontinued,False,https://placekitten.com/61/243
161,matter,Education unit will enjoy. Explain agreement public off early. Summer surface run consider necessary give. Stage student how relationship commercial prepare hold.,Appliances,Tablet,2020-07-21,2024-06-07,Discontinued,False,https://placeimg.com/272/702/any
162,plant,Practice even development skill. Learn chance create body money a. Hold often purpose.,Toys,Mobile,2020-11-01,2024-03-23,Active,False,https://placekitten.com/922/1016
163,responsibility,National same new dream leader million thus. Republican begin front ask. Including include everything investment.,Furniture,Television,2021-05-30,2024-02-22,Active,False,https://placeimg.com/712/983/any
164,only,"Available trade build health learn machine themselves.
Know very discussion deep successful. Sign include financial its test. Carry run fire less reality.",Books,Camera,2021-06-05,2024-02-22,Active,False,https://placekitten.com/596/896
165,those,"Response night authority cover recent its six.
Minute pull send purpose foreign special.",Furniture,Camera,2023-06-11,2024-04-21,Discontinued,True,https://placekitten.com/231/486
166,sort,"Pass window number back deep.
Security figure use even. Trade wall subject fund protect entire hair.
Safe doctor summer foreign. Sell they small short down. She nothing some those including when.",Furniture,Television,2022-09-22,2024-03-15,Active,False,https://dummyimage.com/418x1009
167,north,"Factor must represent. Black time develop nature. Attention answer who make water.
Hard most fall. Two eye ask strong senior save. Evidence center century short spend.",Books,Mobile,2022-10-16,2024-04-17,Active,False,https://placeimg.com/742/669/any
168,long,First event article record best. Authority student visit culture change win.,Books,Camera,2023-04-07,2024-04-22,Active,False,https://dummyimage.com/938x851
169,nor,"Not establish worker picture however morning artist begin. Capital detail better treatment recognize.
College PM opportunity stock course board physical.
Explain bit enter right teach as my cultural.",Toys,Tablet,2022-09-12,2024-02-10,Active,False,https://dummyimage.com/554x193
170,financial,"Late little feeling risk account. Point service century wait while enter remain.
Place Congress wife language. Mention sense probably Mrs sound land suddenly. Far gun will.",Toys,Television,2021-12-04,2024-05-15,Discontinued,False,https://www.lorempixel.com/72/473
171,new,"Establish sea week although increase then. Truth for once rate.
Dog nearly company nature politics. Drug measure member authority. Show process ask science.",Appliances,Laptop,2020-11-24,2024-05-16,Discontinued,True,https://placeimg.com/1/725/any
172,window,"Describe feeling any.
Tv light project almost. Operation air plan beautiful teacher dark give. Hotel will wind deal majority successful.
Behind per hundred drive price.",Books,Laptop,2021-01-02,2024-05-14,Active,True,https://placeimg.com/438/564/any
173,agency,"Thank event hotel worry. Must common traditional floor ago call behind some. Cut prepare soldier fund few five teacher.
Team drop middle. House either commercial likely near court.",Appliances,Tablet,2021-10-18,2024-01-12,Discontinued,True,https://placeimg.com/800/293/any
174,together,"Page brother perhaps necessary. Land physical spend. Bill realize note mean.
Dream drop current candidate. At likely apply couple war rule three. End serve wide task walk enough church.",Furniture,Camera,2023-05-27,2024-04-09,Discontinued,False,https://dummyimage.com/174x1014
175,college,"Important speak own travel size. Since role control six.
Actually something view dark. Wait across run surface discussion sometimes rather major. Similar truth stock artist itself.",Books,Mobile,2020-05-17,2024-04-15,Active,False,https://placekitten.com/343/20
176,debate,"Something look across wind somebody. Win general few white sense add.
Member age book. Majority stop become purpose drive western red manage. Today add expect stand raise.",Appliances,Mobile,2021-04-28,2024-03-18,Discontinued,True,https://dummyimage.com/1014x841
177,believe,Use tell provide tree always next. Rather apply social young fly of. Cost all difficult want avoid Mr nation. Sometimes tell power others.,Electronics,Laptop,2020-01-26,2024-01-19,Active,True,https://placeimg.com/222/281/any
178,happy,"Pass ball grow huge a interview soldier. Late break prove event answer father prepare Republican.
Whose rock effect meeting enough total. Senior many control blood force personal we huge.",Books,Laptop,2021-12-23,2024-05-09,Discontinued,True,https://placekitten.com/729/1011
179,sure,"President improve wait drop its. Born thank so international very.
Open well sense coach never. Bring back history suggest and each.",Toys,Mobile,2021-12-10,2024-01-26,Active,False,https://dummyimage.com/627x431
180,pressure,First case travel about firm tell get. Per customer rock card face. Analysis course radio big particularly class.,Electronics,Mobile,2021-02-23,2024-05-21,Discontinued,True,https://dummyimage.com/663x300
181,difficult,Him laugh within off just everyone professor federal. Set consumer issue newspaper. Score door speech. Investment draw consider score civil.,Appliances,Television,2021-01-08,2024-05-16,Discontinued,True,https://dummyimage.com/10x428
182,upon,"Goal picture last. Sport also reason or about.
Artist hotel girl still rise decision officer. Amount service any. Do imagine approach strong business fear.",Toys,Laptop,2022-05-12,2024-05-19,Active,False,https://placeimg.com/283/244/any
183,theory,Far serve cold professor. Represent hospital star course bed court. This national or environmental sort actually again theory. A voice enter Mrs daughter third exactly.,Furniture,Laptop,2020-06-16,2024-01-19,Active,True,https://placeimg.com/28/219/any
184,expect,Young even white father. Play sort tax father house form key. Other indicate know across case difference. Person memory series your produce development shake.,Electronics,Mobile,2021-06-13,2024-01-04,Discontinued,False,https://www.lorempixel.com/644/880
185,claim,"Technology only hold age. Professional animal possible reduce start individual myself.
Evidence act wife question. Bring president difficult practice. Movie evidence room Mrs fight ahead.",Books,Laptop,2022-01-23,2024-01-14,Discontinued,True,https://placeimg.com/231/655/any
186,change,"Between face skill business.
Accept base child trade production fill economy. Approach across much career against political building often.",Furniture,Laptop,2023-07-18,2024-01-30,Discontinued,True,https://placekitten.com/605/471
187,size,"Describe expect increase me decide. Store paper leader fact coach according.
Likely successful catch line American. Beautiful large nice move drive learn lot.",Toys,Mobile,2023-06-02,2024-01-10,Active,False,https://placeimg.com/481/56/any
188,ability,Reason prepare population he. Everything drug truth. Apply country dark another keep.,Books,Mobile,2024-04-09,2024-01-14,Discontinued,True,https://www.lorempixel.com/243/992
189,billion,"Generation town movement community clear talk responsibility. Republican soldier theory many sea bad nation. Policy physical some anything.
Story thousand over. Tree set parent stay.",Furniture,Television,2022-08-31,2024-04-05,Active,False,https://dummyimage.com/574x780
190,add,Collection ago just audience research as. Drop method hand past father. Daughter enjoy nearly official require. Employee book figure will campaign.,Appliances,Tablet,2023-01-28,2024-02-11,Discontinued,True,https://placekitten.com/888/205
191,free,"Leader ask difficult second. Today place behavior time argue reality.
Success four like reduce serious support. Everyone talk relationship letter. Kitchen case official woman week likely option.",Toys,Television,2021-02-11,2024-06-02,Discontinued,True,https://placekitten.com/160/106
192,everyone,"Practice road church. Strong main front house.
Task wind course her. Send upon attention.
Central positive respond role show week team. More stock hard hair thousand inside game.",Furniture,Camera,2023-09-08,2024-01-06,Discontinued,False,https://placekitten.com/485/431
193,share,"Break message move. Country morning tree surface wait.
Street drive who indeed. Raise place prepare particularly occur. Treat despite difference evening.",Electronics,Laptop,2023-12-18,2024-05-05,Active,False,https://placekitten.com/891/478
194,usually,"Star store get. As including that organization. Note cause one sure.
Movement method time. Particular shake argue total. Something wide trial threat window two where.",Appliances,Camera,2021-05-11,2024-06-20,Discontinued,False,https://placekitten.com/341/957
195,no,"Wind great against employee quickly. Ground among claim show boy challenge.
Security catch the less say. Night report yard. Institution address government Mr loss against last.",Appliances,Tablet,2022-09-24,2024-06-06,Active,True,https://dummyimage.com/682x185
196,run,Lead serve environment star whether figure those. Great president situation bed itself before behavior.,Electronics,Camera,2020-02-07,2024-05-18,Active,False,https://placekitten.com/250/632
197,report,"Film shake door deal force brother among local. Authority help option accept although mention.
Low agreement development on have threat mean. Find follow voice force. They data put fire sound.",Appliances,Tablet,2022-09-19,2024-05-02,Active,False,https://placekitten.com/881/971
198,page,Environmental only he among. Generation trip hard. Almost spend us walk common.,Electronics,Television,2020-01-27,2024-03-31,Discontinued,False,https://dummyimage.com/317x528
199,middle,Spring process risk message. Us you particularly similar usually. Actually give great young very feel side green.,Books,Tablet,2022-12-09,2024-02-23,Discontinued,True,https://www.lorempixel.com/502/261
200,analysis,"Your former almost up several.
A pressure write. Nation close sell job under wide.
Rise partner well through. Focus establish we your air.",Toys,Mobile,2020-06-22,2024-03-02,Active,False,https://dummyimage.com/1013x83
